{"amendment_history":[],"code_identity":{"code_and_schema_sha256":"daf04af72a4d4008f691a03a926a43ba232732bdbd5f75eb19430c157eb0e44b","git_commit":"5b873bd18889c8438e3c6d461c1e846db96b0629","git_state":"clean","package_version":"0.1.1","schema_sha256":{"contracts/v1/algorithm-recommendation.schema.json":"a8da243061a06ca44e07389d134e58b336b0c2e4cdc58abd11d1c24a4483c91a","contracts/v1/dataset-manifest.schema.json":"da60b565a01102598c8478b667bb320c544e7ddd095c8b7bdd4bb9cd773947a7","contracts/v1/experiment.schema.json":"4c23ac262b4ddc37737a88b18e600465776124f74949fbb774f56ac2fd769015","contracts/v1/finding-validation.schema.json":"e11faf34a694e4bb798623136a0da02c1024d5d9693ad1a8474cb27a3f1ac52b","contracts/v1/finding.schema.json":"e94555523044f0d02ea7165c91f57e0b4891c074fc2c3a5e92f8b6235412bc8f","contracts/v1/metric-definition.schema.json":"ad7d1101a4d8ce900c4633f20e0256b21bbb34a2eb5eae6098d5cfa7fb7ecfe6","contracts/v1/normalized-manifest.schema.json":"f6216bb6f99cf70b3428f4df6c181619b9b1261297db733309fff902b1f2d993","contracts/v1/normalized-record.schema.json":"74148f59bf39081e59141b906eb37bd0bed5fad6e8ce4a9552820bfe900238f1","contracts/v1/product-export-definition.schema.json":"b2ca27b8ad7a6524c49023d130dcaac877982742c3944e3b5d08ed81c9086c00","contracts/v1/product-export-manifest.schema.json":"db47970dd497a5996e9066ff66c4e42686bf3af201d95f0f96e5f04f99465a0c","contracts/v1/product-provenance-summary.schema.json":"aa495758a7b94e161b7275f3ad2d225aa171af3ce8ec3fb7d71d73d9459cb7d2","contracts/v1/protocol-amendment.schema.json":"95db7de234be1cd941c120f5b4cbc09ffe3a93a2a9007defe8348bac8b563f0e","contracts/v1/protocol-freeze.schema.json":"a483f3ebbc26c8f50c9f703b9ec670eebccb63e89b132304019fd60f6064f88b"}},"freeze_id":"synthetic-mechanics-demo-protocol.freeze","freeze_sha256":"34fc34030e5518dd4d9530cfd05a530f9a4718002c5cc2b8cfadae286ccef175","frozen_at":"2026-08-19T00:00:00Z","protocol":{"analysis_methods":["Validate source hashes, normalized records, record counts, export metadata, and every exported payload hash","Compare independently generated export files byte for byte"],"apex_labs_source_commit":"5b873bd18889c8438e3c6d461c1e846db96b0629","baseline_condition":"First deterministic software run.","comparability_requirements":["Repeat runs use byte-identical declared inputs and the same package version"],"controlled_variables":["Fixture bytes","Dataset manifest","Apex Labs package version","Export definition"],"created_at":"2026-08-19T00:00:00Z","exclusion_criteria":["Any run with modified fixture bytes, configuration, or contract version"],"experiment_id":"synthetic-mechanics-demo-protocol","hypothesis":"Versioned validation, normalization, provenance, and export mechanics can operate deterministically on fabricated input.","independent_variable":{"levels":["first-run","repeat-run"],"name":"software-run","operational_definition":"A local invocation of the versioned Apex Labs mechanics against the immutable synthetic fixture."},"intervention_conditions":["Repeat deterministic software run"],"minimum_sample_requirements":{"rationale":"This is a deterministic software demonstration requirement, not a scientific sample-size claim.","requirements":["Use exactly one immutable synthetic fixture and repeat generation independently at least twice"],"state":"declared"},"notes":["This protocol exists only to keep the mechanics finding separate from the first real racing campaign.","Its finding must remain synthetic_demo and do_not_implement."],"null_hypothesis":"The software path cannot reproduce the same normalized and export artifacts from the same fabricated input.","predeclared_success_criteria":{"criteria":["All structural validators and integrity checks pass","Independent export generations are byte-identical"],"falsification_criteria":["Any input-bound hash mismatch is accepted","Repeated identical inputs produce different normalized or export bytes"],"state":"declared"},"primary_dependent_metric":{"definition":"Count of validated normalized telemetry-sample records.","metric_id":"demo-record-count","provenance_expectation":"derived","unit":"count"},"randomization_counterbalancing":"Not applicable to a deterministic software fixture; repeated outputs are compared byte for byte.","research_question":"Can the Milestone 0 software path process a tiny synthetic dataset while refusing to treat it as scientific evidence?","safety_constraints":["Use only fabricated data with no real driver, customer, simulator, or production source","Never infer racing performance from the fixture"],"schema_version":"apex-labs.experiment/v1","secondary_metrics":[],"status":"preregistered","synthetic":true,"version":"1.0.0"},"protocol_id":"synthetic-mechanics-demo-protocol","protocol_sha256":"5edcb313f7d8e2bc2f6adb0cfabd8ebb8f8e2f417a5d5ce3faefecd9a71b43f7","protocol_version":"1.0.0","randomization":{"method":"Deterministic synthetic mechanics fixture; no participant assignment","schedule":[],"schedule_id":"not-applicable","schedule_sha256":"37517e5f3dc66819f61f5a7bb8ace1921282415f10551d2defa5c3eb0985b570","seed":null,"strategy":"not_applicable"},"schema_version":"apex-labs.protocol-freeze/v1","source_commit":"5b873bd18889c8438e3c6d461c1e846db96b0629","synthetic":true}
