{"amendment_history":[],"code_identity":{"code_and_schema_sha256":"bc3af4f2e445ae3357ea2fb7ff30043efaa4ea1c59f00d5510954753cba88f3b","git_commit":"e06c9b9299d1a1d1c6fad4439f7211bffb7279be","git_state":"dirty","package_version":"0.2.0","schema_sha256":{"contracts/v1/adapter-conformance.schema.json":"3eb0c58023c3660d9d9de71009163528ef25a78c89cca32c9cffba30dd047feb","contracts/v1/algorithm-recommendation.schema.json":"a8da243061a06ca44e07389d134e58b336b0c2e4cdc58abd11d1c24a4483c91a","contracts/v1/analysis-definition.schema.json":"5e4b769bd14f5d395122547b42e284339de0d177b29b371726583b11a1f57a32","contracts/v1/analysis-run.schema.json":"b3576f3f8b8bfb106a9bd845597a5a9460bf6e4183613ae6bef468fe2ce11aaf","contracts/v1/apex-research-session-export.schema.json":"5432cf9034b72bc8dc9c99c45c76dac07e320036460b0a7e4092c029bbf698b6","contracts/v1/apex-session-bundle-manifest.schema.json":"4edecc8a2f9dab18f9a4653de5b600fd6f707a2b738d6e3ecf809dda35574809","contracts/v1/collection-record.schema.json":"28f12597842f904c992fa606ba99863668cdd2fa8338c443992ac6de2d60e158","contracts/v1/dataset-manifest.schema.json":"da60b565a01102598c8478b667bb320c544e7ddd095c8b7bdd4bb9cd773947a7","contracts/v1/evidence-set-definition.schema.json":"74567b5b1fb345afa686deaa96927855cff367c415f02c90ec33263146cce050","contracts/v1/evidence-set.schema.json":"10451b1e5650c724271f5c0af0abc6d3457e749db4fea9aab24bec7f8e451909","contracts/v1/experiment.schema.json":"4c23ac262b4ddc37737a88b18e600465776124f74949fbb774f56ac2fd769015","contracts/v1/finding-review-package.schema.json":"26e4fc0d071d93083e3b5b8d1c6469b7e8ede5319b354e73bd504421cc017a25","contracts/v1/finding-validation.schema.json":"e11faf34a694e4bb798623136a0da02c1024d5d9693ad1a8474cb27a3f1ac52b","contracts/v1/finding.schema.json":"e94555523044f0d02ea7165c91f57e0b4891c074fc2c3a5e92f8b6235412bc8f","contracts/v1/hypothesis-transition.schema.json":"9625ea4d132f1fde1f7372aea5410faaf1136be1c71fd1c69718fb61c362a042","contracts/v1/hypothesis.schema.json":"f680f78b322965353cd7480eb02829258f2c7c2cc84ec2d084d1699bcde3c369","contracts/v1/inferential-analysis-definition.schema.json":"17aeddf93e7b300454cd5f02b2fa76cb517834727e6f4a8d9af98a5cf2b19585","contracts/v1/inferential-analysis-run.schema.json":"1fc9d6152e0c885b4b4518533f6d5422d323dc072a9dfd6e0606beba78658694","contracts/v1/metric-definition.schema.json":"ad7d1101a4d8ce900c4633f20e0256b21bbb34a2eb5eae6098d5cfa7fb7ecfe6","contracts/v1/normalized-manifest.schema.json":"76371da2db78f1959e154e3bbdc9e62369811df800b298adb87cb27ac31d4394","contracts/v1/normalized-record.schema.json":"0e7dc63d9b4aed2650ec44b29bdf29e9e352fa01efddadaaa104f0eaf89255e9","contracts/v1/product-annotations.schema.json":"9cf705bf2ae0d88a761138636de3493572f936aec62d7683d0879d12274ece4b","contracts/v1/product-export-definition.schema.json":"b2ca27b8ad7a6524c49023d130dcaac877982742c3944e3b5d08ed81c9086c00","contracts/v1/product-export-manifest.schema.json":"db47970dd497a5996e9066ff66c4e42686bf3af201d95f0f96e5f04f99465a0c","contracts/v1/product-provenance-summary.schema.json":"aa495758a7b94e161b7275f3ad2d225aa171af3ce8ec3fb7d71d73d9459cb7d2","contracts/v1/protocol-amendment.schema.json":"95db7de234be1cd941c120f5b4cbc09ffe3a93a2a9007defe8348bac8b563f0e","contracts/v1/protocol-freeze.schema.json":"a483f3ebbc26c8f50c9f703b9ec670eebccb63e89b132304019fd60f6064f88b","contracts/v1/segment-definition.schema.json":"c394cb7c51af573dd01bb9cfe9f87010cbbc3bb29e5b2e2a6490e3550df6e97e"}},"freeze_id":"synthetic-inference-observational.freeze","freeze_sha256":"5e443f6b356e8923c5905e51ae44abaff5daea174709f39692d94ef10230355d","frozen_at":"2026-08-20T00:00:00Z","protocol":{"analysis_methods":["Report attrition and robust descriptive summaries before any contrast","Estimate the paired difference at the declared experimental unit","Resample whole blocks rather than nested laps when forming an interval","Run the declared leave-one-out and order-effect falsification checks","Apply the declared familywise correction across the declared comparison family"],"apex_labs_source_commit":"UNCOMMITTED","baseline_condition":"The earlier observed fabricated block. No instruction or cue was delivered.","comparability_requirements":["Compare only within one verified segment geometry on one layout","Use within-driver pairing across observed blocks of the same participant","Treat the observed block as the level at which the compared condition varies","Never describe an observed block difference as an effect of anything Apex Sim Coach did"],"controlled_variables":["Driver, simulator, car, track, and layout are held fixed across blocks","Segment definition and metric definition are frozen before construction","Normalization contract and adapter version are held fixed","Block labelling is fixed before any value is inspected"],"created_at":"2026-08-20T00:00:00Z","exclusion_criteria":["Records positioned outside the declared segment region","Records whose metric channel is absent or explicitly unavailable","Records belonging to a lap the source marked invalid","Records carrying an incident or off-track state","Records carrying a pit, replay, or discontinuity quality flag","Units below the declared minimum record count or concept-coverage ratio"],"experiment_id":"synthetic-inference-observational","hypothesis":"Two observed blocks of the same fabricated driver can be compared descriptively and associationally without a delivered intervention.","independent_variable":{"levels":["synthetic-observed-early","synthetic-observed-late"],"name":"observed-block","operational_definition":"Each contiguous fabricated block is labelled by the condition observed during collection. Nothing was delivered to the driver."},"intervention_conditions":[],"minimum_sample_requirements":{"rationale":"These are deliberately modest fabricated-demonstration thresholds. They are software requirements for exercising the sufficiency gate, not a scientific power calculation, and no real campaign may inherit them.","requirements":["At least 4 comparable within-driver pairs and at least 2 blocks for a mechanics-level contrast","At least 12 comparable within-driver pairs and at least 4 blocks before any confirmatory interpretation of a real corpus"],"state":"declared"},"notes":["This protocol exists to demonstrate that an observational comparison is refused any causal interpretation.","Session order is not a delivered intervention and is never treated as one."],"null_hypothesis":"The observed blocks cannot be compared comparably, or the comparison cannot be reproduced.","predeclared_success_criteria":{"criteria":["The evidence set is reproducible from its declared inputs","The association and its interval are reproducible from the bound evidence"],"falsification_criteria":["The direction of the association is carried by a single unit","The association disappears once the block ordering is accounted for"],"state":"declared"},"primary_dependent_metric":{"definition":"Lowest speed observed inside the declared segment on one lap.","metric_id":"segment-minimum-speed","provenance_expectation":"derived","unit":"m/s"},"randomization_counterbalancing":"No assignment occurs. Blocks are observed in the order they happened, which is why the design cannot exceed association.","research_question":"Can Apex Labs compare two naturally occurring fabricated blocks without any intervention, and refuse every interpretation stronger than association?","safety_constraints":["Use only fabricated data with no real driver, customer, simulator, or production source","Never infer racing performance from this protocol"],"schema_version":"apex-labs.experiment/v1","secondary_metrics":[{"definition":"Along-lap distance at which brake pressure was last at or above the declared threshold inside the segment.","metric_id":"segment-brake-release-distance","provenance_expectation":"derived","unit":"m"}],"status":"preregistered","synthetic":true,"version":"1.0.0"},"protocol_id":"synthetic-inference-observational","protocol_sha256":"ce8df3c0015ef50bc0b9b8d162c7ed6bb3a3ca24d4d1b1cf6080cb8529149cdf","protocol_version":"1.0.0","randomization":{"method":"No assignment occurs; fabricated blocks are observed in the order they happened.","schedule":[],"schedule_id":"not-applicable","schedule_sha256":"37517e5f3dc66819f61f5a7bb8ace1921282415f10551d2defa5c3eb0985b570","seed":null,"strategy":"not_applicable"},"schema_version":"apex-labs.protocol-freeze/v1","source_commit":"UNCOMMITTED","synthetic":true}
